{
  "godscore": 5,
  "status": "collapse",
  "passed": false,
  "fired": true,
  "mean_step": 20,
  "drift_step": 4,
  "breach_step": null,
  "collapse_step": 31,
  "lead_time": 11,
  "reasons": [
    "mean slope trigger detected",
    "drift confirmed",
    "gated sentinel fired",
    "collapse threshold crossed"
  ]
}
